{
  "format": 1,
  "id": "from_clicks_to_code",
  "title": "From clicks to code",
  "concept": "A program is commands that run top to bottom",
  "topics": [
    "running_scripts.statements_run_in_order"
  ],
  "watch": {
    "world": {
      "width": 5,
      "height": 3,
      "start": [
        0,
        2,
        "E"
      ],
      "gems": {
        "2,0": 1
      },
      "blocked": [
        [
          3,
          2
        ],
        [
          3,
          1
        ]
      ]
    },
    "steps": [
      {
        "say": "Your 'Pick it up' button presses, as a program. Run it and watch each line.",
        "code": "move()\nmove()\nturn_left()\nmove()\nmove()\npick()\n",
        "code_from": "drive_pick",
        "run": true
      }
    ]
  },
  "guided": {
    "level": "first_steps",
    "steps": [
      {
        "say": "Add one `move()` line for each cell between the robot and the gem.",
        "done_when": [
          {
            "calls": "move",
            "min": 3,
            "outside": "def"
          }
        ],
        "example": "move()\nmove()\nmove()\n"
      },
      {
        "say": "Then `pick()` it up.",
        "done_when": [
          {
            "calls": "pick"
          }
        ],
        "example": "move()\nmove()\nmove()\npick()\n"
      },
      {
        "say": "Run it.",
        "done_when": [
          {
            "run": "passed"
          }
        ]
      }
    ],
    "done": "Your first typed program."
  },
  "practice": [
    "turn_corner"
  ],
  "recap": {
    "say": "A program is a list of commands that run top to bottom.",
    "code": "move()\nturn_left()\npick()"
  },
  "hints": {
    "turn_corner": [
      "Watch the replay: where does the robot stop, and which way is it facing then?",
      "Count the cells along each side of the wall. Does each side need the same number of move() lines?",
      "move()\nmove()\nmove()\nturn_left()\n__\n__\n__\n__\n__\n__\n__\npick()\n"
    ]
  }
}
