{
  "format": 1,
  "id": "name_a_move",
  "title": "Name a move",
  "concept": "Define a new command with def, then call it",
  "topics": [
    "functions.define_and_call"
  ],
  "watch": {
    "world": {
      "width": 4,
      "height": 1,
      "start": [
        0,
        0,
        "E"
      ],
      "gems": {
        "2,0": 1
      }
    },
    "steps": [
      {
        "say": "Run it: fetch the gem, then come back.",
        "code": "move()\nmove()\npick()\nturn_left()\nturn_left()\nmove()\nmove()\n",
        "run": true
      },
      {
        "say": "`def` gives the two left turns one name. A def alone doesn't move the robot.",
        "code": "def turn_around():\n    turn_left()\n    turn_left()\n\nmove()\nmove()\npick()\nturn_left()\nturn_left()\nmove()\nmove()\n",
        "focus": "editor:1"
      },
      {
        "say": "Use the name where the two lines were.",
        "code": "def turn_around():\n    turn_left()\n    turn_left()\n\nmove()\nmove()\npick()\nturn_around()\nmove()\nmove()\n",
        "focus": "editor:8"
      },
      {
        "say": "Where will the robot end up?",
        "predict": {
          "cell": true,
          "answer": [
            0,
            0
          ]
        }
      },
      {
        "say": "Run it.",
        "run": true
      }
    ]
  },
  "guided": {
    "level": "turn_right",
    "steps": [
      {
        "say": "Fill in `turn_right()` with three left turns.",
        "done_when": [
          {
            "defines": "turn_right",
            "body_calls": {
              "turn_left": 3
            }
          }
        ],
        "example": "def turn_right():\n    turn_left()\n    turn_left()\n    turn_left()\n\nmove()\nmove()\n"
      },
      {
        "say": "Use `turn_right()` wherever the robot must turn right. Two turns are needed.",
        "done_when": [
          {
            "calls": "turn_right",
            "outside": "def",
            "min": 2
          }
        ],
        "example": "def turn_right():\n    turn_left()\n    turn_left()\n    turn_left()\n\nmove()\nmove()\nturn_right()\nmove()\nmove()\nturn_right()\nmove()\nmove()\n"
      },
      {
        "say": "Now `pick()` up the gem.",
        "done_when": [
          {
            "calls": "pick",
            "outside": "def"
          }
        ],
        "example": "def turn_right():\n    turn_left()\n    turn_left()\n    turn_left()\n\nmove()\nmove()\nturn_right()\nmove()\nmove()\nturn_right()\nmove()\nmove()\npick()\n"
      },
      {
        "say": "Run it.",
        "done_when": [
          {
            "run": "passed"
          }
        ]
      }
    ],
    "done": "Same route as 'Only left turns', now with your own `turn_right()`."
  },
  "practice": [
    "fetch_gem",
    "climb_stairs"
  ],
  "twist": "around_the_block",
  "recap": {
    "say": "`def name():` plus an indented body makes a command. `name()` runs it.",
    "code": "def name():\n    ..."
  },
  "hints": {
    "fetch_gem": [
      "Compare your result with the Goal view: home again, facing east.",
      "Turning around is two left turns. Give it a name with `def turn_around():`.",
      "def turn_right():\n    turn_left()\n    turn_left()\n    turn_left()\n\n\ndef turn_around():\n    __\n    __\n\n\ndef go_to_gem():\n    move()\n    turn_right()\n    __\n    __\n    __\n    __\n\n\ndef come_home():\n    turn_around()\n    # walk back the way you came\n    __\n    __\n    __\n    __\n    __\n    __\n    # face east again\n    __\n\n\ngo_to_gem()\npick()\ncome_home()\n"
    ],
    "climb_stairs": [
      "Compare your result with the Goal view: the floor ends empty, so the gem on top of the third step must be picked up.",
      "`climb_step()` only climbs one step. Which way must the robot face to go up, and which way to step onto the step?",
      "def turn_right():\n    turn_left()\n    turn_left()\n    turn_left()\n\n\ndef climb_step():\n    turn_left()\n    move()\n    __\n    __\n\n\nclimb_step()\n__\n__\npick()\n"
    ],
    "around_the_block": [
      "Compare your result with the Goal view: four gems picked, and the robot home facing east.",
      "Name one corner as `go_around_corner()` and call it four times. Where must a call stop so the next can start?",
      "def turn_right():\n    turn_left()\n    turn_left()\n    turn_left()\n\n\ndef go_around_corner():\n    move()\n    move()\n    __\n    __\n    __\n\n\ngo_around_corner()\n__\n__\n__\n"
    ]
  }
}
