{
  "format": 1,
  "id": "conditionals",
  "title": "Look before you act",
  "concept": "Run a block only when a condition about the world is True, with else for the other case",
  "topics": [
    "conditionals.if_statement",
    "conditionals.if_else"
  ],
  "watch": {
    "world": {
      "width": 7,
      "height": 1,
      "start": [
        0,
        0,
        "E"
      ],
      "gems": {
        "2,0": 1,
        "3,0": 1,
        "5,0": 1
      }
    },
    "steps": [
      {
        "say": "Pick up every gem in the 6-cell row. Some cells are empty.",
        "focus": "world"
      },
      {
        "say": "Move, then pick, 6 times.",
        "code": "for i in range(6):\n    move()\n    pick()\n",
        "focus": "editor:3"
      },
      {
        "say": "This would stop on cell 1: it is empty, so `pick()` fails with \"There's no gem here.\"",
        "focus": "cell:1,0"
      },
      {
        "say": "Look first. `if gems_here():` runs the indented `pick()` only when the cell has a gem.",
        "code": "for i in range(6):\n    move()\n    if gems_here():\n        pick()\n",
        "focus": "editor:3"
      },
      {
        "say": "Which cells still have gems at the end?",
        "predict": {
          "choices": [
            "None of them",
            "Only the last one",
            "All of them"
          ],
          "answer": "None of them"
        }
      },
      {
        "say": "Run it. Empty cells are skipped; every gem is picked.",
        "run": true
      },
      {
        "say": "Same code, gems in other places. The `if` looks again on every cell.",
        "world": {
          "width": 7,
          "height": 1,
          "start": [
            0,
            0,
            "E"
          ],
          "gems": {
            "1,0": 1,
            "4,0": 1,
            "6,0": 1
          }
        },
        "run": true
      }
    ]
  },
  "guided": {
    "level": "pick_where_found",
    "steps": [
      {
        "say": "Walk the row: a `for` loop that runs `move()` 8 times.",
        "done_when": [
          {
            "has": "for",
            "range": 8
          },
          {
            "calls": "move",
            "inside": "for"
          }
        ],
        "example": "for i in range(8):\n    move()\n"
      },
      {
        "say": "After `move()`, look: add `if gems_here():` inside the loop.",
        "done_when": [
          {
            "calls": "gems_here",
            "inside": "for"
          }
        ],
        "example": "for i in range(8):\n    move()\n    if gems_here():\n        pass\n"
      },
      {
        "say": "Indent `pick()` under the `if`, so it runs only on a gem.",
        "done_when": [
          {
            "calls": "pick",
            "inside": "for>if"
          }
        ],
        "example": "for i in range(8):\n    move()\n    if gems_here():\n        pick()\n"
      },
      {
        "say": "Run it. The hidden rows put gems elsewhere.",
        "done_when": [
          {
            "run": "passed"
          }
        ]
      }
    ],
    "done": "Every gem picked, wherever it was."
  },
  "practice": [
    "fill_gaps",
    "flip_row"
  ],
  "twist": "detour",
  "recap": {
    "say": "`if condition:` runs its block only when the condition is True; `else:` runs when it is False.",
    "code": "if condition:\n    ...\nelse:\n    ..."
  },
  "hints": {
    "fill_gaps": [
      "Compare your result with the Goal view: each cell ends with exactly one gem.",
      "`put()` on a full cell makes two. `if not gems_here():` puts only on an empty cell.",
      "for i in range(__):\n    move()\n    if __:\n        put()\n"
    ],
    "flip_row": [
      "Look at the 'all full' world: every gem there should be picked up.",
      "Two `if`s undo each other: after `pick()` the cell is empty, so the second `if` puts a gem back. Use `else:`.",
      "for i in range(7):\n    move()\n    if gems_here():\n        __\n    else:\n        __\n"
    ],
    "detour": [
      "Look at the 'blocked right away' world, and compare with the Goal view.",
      "Each pass: `if front_is_clear():` move, `else:` go around. Going around crosses 2 cells, so 7 passes cross all 8.",
      "def turn_right():\n    turn_left()\n    turn_left()\n    turn_left()\n\n\ndef go_around():\n    turn_left()\n    move()\n    turn_right()\n    __\n    turn_right()\n    move()\n    turn_left()\n\n\nfor i in range(__):\n    if front_is_clear():\n        move()\n    else:\n        __\n"
    ]
  }
}